assumed_quantum_runtime,assumed_classical_runtime,meaningful_domain_max,name,speedup_coarse,description,meaningful_domain,meaningful_domain_min
,,,Quantum Simulation,Superpolynomial,"It is believed that for any physically realistic Hamiltonian \n<i>H</i> on <i>n</i> degrees of freedom, the corresponding time evolution operator \n \\( e^{-i H t} \\) can be implemented using poly(<i>n,t</i>) gates. Unless BPP=BQP,\n this problem is not solvable in general on a classical computer in polynomial time.\n Many techniques for quantum simulation have been developed for\n general classes of Hamiltonians\n [<a href=""#Childs_thesis"">25</a>,<a href=""#Zalka_sim"">95</a>,<a href=""#Wiesner_sim"">92</a>,<a href=""#Aharonov_Tashma"">5</a>,<a href=""#Cleve_sim"">12</a>,<a href=""#Childs_Wiebe12"">170</a>,<a href=""#BCS13"">205</a>,<a href=""#BCCKS14"">211</a>,<a href=""#BCCKS14b"">244</a>,<a href=""#BCK15"">245</a>,<a href=""#Som15"">278</a>,<a href=""#Som15"">293</a>,<a href=""#LC16"">294</a>,<a href=""#BN16"">295</a>,<a href=""#BT97"">372</a>,<a href=""#LC16b"">382</a>],\n chemical dynamics\n [<a href=""#Kassal_sim"">63</a>,<a href=""#Lidar_sim"">68</a>,<a href=""#HWBT15"">227</a>,<a href=""#RWSWT16"">310</a>,<a href=""#SW17"">375</a>], condensed\n matter physics\n [<a href=""#Abrams_sim"">1</a>,<a href=""#Wu_sim"">99</a>, <a href=""#Ortiz"">145</a>], relativistic quantum mechanics (the Dirac and Klein-Gordon equations) [<a href=""#AW16"">367</a>,<a href=""#CJO17"">369</a>,<a href=""#Yepez11"">370</a>,<a href=""Yepez13"">371</a>],\n open quantum systems [<a href=""#CW16"">376</a>, <a href=""#KBGKE11"">377</a>,<a href=""#CL16"">378</a>,<a href=""#DPCSC15"">379</a>], \n and quantum field theory\n [<a href=""#Byrnes"">107</a>,<a href=""#JLP12"">166</a>,<a href=""#JLP14a"">228</a>,<a href=""#JLP14b"">229</a>,<a href=""#BRSS14"">230</a>,<a href=""#MJ17"">368</a>].\n The exponential complexity of classically simulating quantum systems led Feynman to \n first propose that quantum computers might outperform classical computers on certain tasks \n[<a href=""#Feynman"">40</a>]. Although the problem of finding ground energies of local \n Hamiltonians is QMA-complete and therefore probably requires exponential time on a quantum \n computer in the worst case, quantum algorithms have been developed to approximate ground \n[<a href=""#Aspuru_science"">102</a>,<a href=""#WKAH08"">231</a>,<a href=""#KA09"">232</a>,<a href=""#WBA11"">233</a>,<a href=""#TL13"">234</a>,<a href=""#W13"">235</a>,<a href=""#FKT16"">308</a>,<a href=""#SA15"">321</a>,<a href=""#SCV13"">322</a>,<a href=""#BBK17"">380</a>,<a href=""#PKS17"">381</a>] \nand thermal [<a href=""#Metropolis"">132</a>,<a href=""#Poulin_Wocjan"">121</a>,<a href=""#RGE12"">281</a>,<a href=""#KB16"">282</a>,<a href=""#CS16"">307</a>] \nstates for some classes of Hamiltonians. Efficient quantum algorithms have been also obtained for preparing certain classes of tensor network states \n[<a href=""#SSVCW05"">323</a>,<a href=""#SHWCS07"">324</a>,<a href=""#GMC16"">325</a>,<a href=""#STV12"">326</a>,<a href=""#SCTVP13"">327</a>,<a href=""#SBE16"">328</a>].\n",,
,,,Knot Invariants,Superpolynomial,"As shown by \nFreedman [<a href=""#Freedman"">42</a>,\n<a href=""#Freedman2"">41</a>], <i>et al.</i>, finding a certain additive approximation to the Jones\n polynomial of the plat closure of a braid at \\( e^{i 2 \\pi/5} \\) is a BQP-complete problem. This \n result was reformulated and extended to \\( e^{i 2 \\pi/k} \\) for arbitrary <i>k</i> by Aharonov \n <i>et al.</i> [<a href=""#Aharonov1"">4</a>,<a href=""#Aharonov2"">2</a>]. Wocjan and Yard further\n generalized this, obtaining a  quantum algorithm to estimate the HOMFLY polynomial \n [<a href=""#Wocjan"">93</a>], of which the Jones polynomial is a special case. Aharonov \n <i>et al.</i> subsequently showed that quantum computers can in polynomial time estimate a\n certain additive approximation to the even more general Tutte polynomial for planar \n graphs [<a href=""#Aharonov3"">3</a>]. It is not fully understood for what range of parameters \n the approximation obtained in [<a href=""#Aharonov3"">3</a>] is BQP-hard. (See also <a href=""#part_func"">partition \n functions</a>.) Polynomial-time quantum algorithms have also been\n discovered for additively approximating link invariants arising from\n quantum doubles of finite groups\n [<a href=""#Krovi_Russell12"">174</a>]. (This problem is not known to\n be BQP-hard.) As shown in [<a href=""#Shor_Jordan"">83</a>], the\n problem of finding a certain additive approximation to the Jones\n polynomial of the <em>trace</em> closure of a braid at  \\( e^{i 2 \\pi/5} \\) is\n DQC1-complete.\n",,
,,,Three-manifold Invariants,Superpolynomial,"The Turaev-Viro invariant is a function that takes\n three-dimensional manifolds as input and produces a real number as output. Homeomorphic\n manifolds yield the same number. Given a three-manifold specified by a Heegaard splitting,\n a quantum computer can efficiently find a certain additive approximation to its\n Turaev-Viro invariant, and this approximation is BQP-complete [<a href=""#AJKR"">129</a>].\n Earlier, in [<a href=""#Garnerone"">114</a>], a polynomial-time quantum algorithm was given\n to additively approximate the Witten-Reshitikhin-Turaev (WRT) invariant of a manifold\n given by a surgery presentation. Squaring the WRT invariant yields the Turaev-Viro\n invariant. However, it is unknown whether the approximation achieved in \n [<a href=""#Garnerone"">114</a>] is BQP-complete. A suggestion of a possible link between\n quantum computation and three-manifold invariants was also given in \n [<a href=""#Kauffman"">115</a>].\n",,
,,,Partition Functions,/b> Partition Functions,"For a classical system with a finite set of states <i>S</i> the\n partition function is \\( Z = \\sum_{s \\in S} e^{-E(s)/kT} \\), where <i>T</i> is the\n temperature and <i>k</i> is Boltzmann\'s constant. Essentially every thermodynamic \n quantity can be calculated by taking an appropriate partial derivative of the partition\n function. The partition function of the Potts model is a special case of the Tutte\n polynomial. A quantum algorithm for approximating the Tutte polynomial is given in \n [<a href=""#Aharonov3"">3</a>]. Some connections between these approaches are  discussed\n in [<a href=""#Lidar_Ising"">67</a>]. Additional algorithms for estimating partition\n functions on quantum computers are given in [<a href=""#Arad_Landau"">112</a>,<a href=""#VdN"">113</a>,<a href=""#Geraci_QWGT1"">45</a>,<a href=""#Geraci_exact"">47</a>]. \n A BQP-completeness result (where the ""energies"" are allowed to be complex) is also given in \n [<a href=""#VdN"">113</a>]. A method for approximating partition functions by simulating \n thermalization processes is given in [<a href=""#Poulin_Wocjan"">121</a>]. A quadratic speedup\n for the approximation of general partition functions is given in\n [<a href=""#WCAN"">122</a>]. A method based on quantum walks, achieving\n polynomial speedup for evaluating partition functions is given in\n [<a href=""#M15b"">265</a>].\n",,
O( sqrt(N)),,,Adiabatic Algorithms,/b> Adiabatic Algorithms,"In adiabatic quantum computation one starts with\n an initial Hamiltonian whose ground state is easy to prepare, and\n slowly varies the Hamiltonian to one whose ground state encodes the\n solution to some computational problem. By the adiabatic theorem, the\n system will track the instantaneous ground state provided the\n variation of the Hamiltonian is sufficiently slow. The runtime of an\n adiabatic algorithm scales at worst as \\(1/ \\gamma^3 \\) where \\( \\gamma \\)\n is the minimum eigenvalue gap between the ground state\n and the first excited state [<a href=""#JRS06"">185</a>]. If the\n Hamiltonian is varied sufficiently smoothly, one can improve this to\n \\( \\widetilde{O}(1/\\gamma^2) \\) [<a href=""#EH12"">247</a>]. Adiabatic\n quantum computation was first proposed by Farhi <i>et al.</i> as a\n method for solving NP-complete combinatorial optimization problems\n [<a href=""#Farhi_adiabatic"">96</a>, <a href=""#FGGLLP01"">186</a>]. Adiabatic quantum algorithms for\n optimization problems typically use ""stoquastic"" Hamiltonians, which\n do not suffer from the sign problem. Such algorithms are sometimes\n referred to as quantum annealing. Adiabatic quantum computation with\n non-stoquastic Hamiltonians is as powerful as the quantum circuit \n model [<a href=""#Aharonov_adiabatic"">97</a>]. Adiabatic algorithms\n using stoquastic Hamiltonians are probably less powerful\n [<a href=""#BDOT06"">183</a>], but may be nevertheless more powerful\n than classical computation. The asymptotic runtime of adiabatic\n optimization algorithms is notoriously difficult to analyze, but some\n progress has been achieved\n [<a href=""#AKR09"">179</a>,<a href=""#R04"">180</a>,<a href=""#FGG02"">181</a>,<a href=""#FGGGMS09"">182</a>,<a href=""#FGGN05"">187</a>,<a href=""#FGGS10"">188</a>,<a href=""#FGG02B"">189</a>,<a href=""#vDMV01"">190</a>,<a href=""#FGHSSYZ12"">191</a>,<a href=""#IM08"">226</a>]. (Also\n relevant is an earlier literature on quantum annealing, which\n originally referred to a classical optimization algorithm that works by \n simulating a quantum process, much as simulated annealing is a\n classical optimization algorithm that works by simulating a thermal\n process. See <em>e.g.</em>\n [<a href=""#FGSSD94"">199</a>, <a href=""#MN08"">198</a>].) Adiabatic quantum\n computers can perform a process somewhat analogous\n to Grover search in \\( O(\\sqrt{N}) \\) time\n [<a href=""#Roland_Cerf"">98</a>]. Adiabatic quantum algorithms\n achieving quadratic speedup for a more general class of problems are\n constructed in [<a href=""#SB12"">184</a>] by adapting techniques from\n [<a href=""#Szegedy"">85</a>]. Adiabatic quantum algorithms have been\n proposed for several specific problems, including PageRank\n [<a href=""#GZL12"">176</a>], machine learning\n [<a href=""#PL12"">192</a>, <a href=""#NDRM08"">195</a>],\n and graph problems [<a href=""#GC11"">193</a>, <a href=""#GC13"">194</a>].\n Some quantum simulation algorithms also use adiabatic state\n preparation.\n",,
,,,Quantum Approximate Optimization,/b> Quantum Approximate Optimization,"For many combinatorial optimization problems,\nfinding the exact optimal solution is NP-complete. There are also hardness-of-approximation\nresults proving that finding an approximation with sufficiently\nsmall error bound is NP-complete. For certain problems there is a gap\nbetween the best error bound achieved by a polynomial-time classical\napproximation algorithm and the error bound proven to be NP-hard. In\nthis regime there is potential for exponential speedup by quantum\ncomputation. In [<a href=""#FGG14a"">242</a>] a new quantum algorithmic\ntechnique called the Quantum Approximate Optimization Algorithm (QAOA) \nwas proposed for finding approximate solutions to\ncombinatorial optimization problems. In [<a href=""#FGG14b"">243</a>] it\nwas subsequently shown that QAOA solves a combinatorial\noptimization problem called Max E3LIN2 with a better approximation\nratio than any polynomial-time classical algorithm known at the\ntime. However, an efficient classical algorithm achieving an even\nbetter approximation ratio (in fact, the approximation ratio\nsaturating the limit set by hardness-of-approximation) was\nsubsequently discovered [<a href=""#BMO15"">260</a>]. Presently, the power of\nQAOA relative to classical computing is an active area of research \n[<a href=""#LZ16"">300</a>, <a href=""#WHT16"">301</a>, <a href=""#FH16"">302</a>, \n<a href=""#Chamon"">314</a>].\n",,
,,,Semidefinite Programming,/b> Semidefinite Programming,"Given a list of <i>m</i> + 1 Hermitian \\(n \\times n \\)\nmatrices \\(C, A_1, A_2, \\ldots, A_m\\) and <i>m</i> numbers \n\\(b_1, \\ldots, b_m \\), the problem of semidefinite programming is to\nfind the positive semidefinite \\( n \\times n \\)\nmatrix <i>X</i> that maximizes tr(<i>CX</i>) subject to the\nconstraints \\( \\mathrm{tr} (A_j X) \\leq b_j \\) for \\( j = 1,2,\\ldots,\nm \\). Semidefinite programming has many applications in operations\nresearch, combinatorial optimization, and quantum information, and it\nincludes linear programming as a special case. Improving upon\n[<a href=""#BS16"">313</a>], a quantum algorithm is given in [<a href=""#BKL17"">383</a>]\nthat approximately solves semidefinite programs to within \\( \\pm \\epsilon \\) in time \n\\( O (\\sqrt{m} \\log m \\cdot \\mathrm{poly}(\\log n, r, \\epsilon^{-1})) \\), where <i>r</i> is the rank of the semidefinite program. This constitutes a\nquadratic speedup over the fastest classical algorithms when <i>r</i> is small compared to <i>n</i>. The quantum algorithm is based on amplitude amplification and quantum Gibbs sampling\n[<a href=""#Poulin_Wocjan"">121</a>, <a href=""#CS16"">307</a>].\n",,
,,,Zeta Functions,Superpolynomial,"Let  <i>f</i>(<i>x</i>,<i>y</i>) be a degree-<i>d</i>\npolynomial over a finite field \\( \\mathbb{F}_p \\). Let \\( N_r \\) be\nthe number of projective solutions to <i>f</i>(<i>x</i>,<i>y</i> = 0 over the\nextension field \\( \\mathbb{F}_{p^r} \\). The zeta function for <i>f</i>\nis defined to be \\( Z_f(T) = \\exp \\left( \\sum_{r=1}^\\infty\n\\frac{N_r}{r} T^r \\right) \\). Remarkably, \\( Z_f(T) \\) always has the\nform \\( Z_f(T) = \\frac{Q_f(T)}{(1-pT)(1-T)} \\) where \\( Q_f(T) \\) is a\npolynomial of degree 2<i>g</i> and \\(g = \\frac{1}{2} (d-1)(d-2) \\) is\ncalled the genus of <i>f</i>. Given \\( Z_f(T) \\) one can easily\ncompute the number of zeros of <i>f</i> over any extension field \\(\n\\mathbb{F}_{p^r} \\). One can similarly define the zeta function\nwhen the original field over which <i>f</i> is defined does not have\nprime order. As shown by Kedlaya [<a href=""#Kedlaya"">64</a>],\nquantum computers can determine the zeta function of a genus <i>g</i>\ncurve over a finite field \\( \\mathbb{F}_{p^r} \\) in \n\\( \\mathrm{poly}(\\log p, r, g) \\) time. The fastest known classical algorithms\nare all exponential in either log(<i>p</i>) or <i>g</i>. In a\ndiffent, but somewhat related contex, van Dam has conjectured that due\nto a connection between the zeros of <em>Riemann</em> zeta functions\nand the eigenvalues of certain quantum operators, quantum computers\nmight be able to efficiently approximate the number of solutions to\nequations over finite fields [<a href=""#vanDam_zeros"">87</a>].\n",,
,,,Weight Enumerators,Superpolynomial,"Let <i>C</i> be a code on <i>n</i> bits, <i>i.e.</i> a subset of \n \\( \\mathbb{Z}_2^n \\). The weight enumerator of <i>C</i> is \n \\( S_C(x,y) = \\sum_{c \\in C} x^{|c|} y^{n-|c|} \\) where \n |<i>c</i>| denotes the Hamming weight of <i>c</i>. Weight enumerators have many\n uses in the study of classical codes. If <i>C</i> is a linear code, it can be defined by\n \\( C = \\{c: Ac = 0\\} \\) where <i>A</i> is a matrix over \\( \\mathbb{Z}_2 \\)\n In this case \\( S_C(x,y) = \\sum_{c:Ac=0} x^{|c|} y^{n-|c|} \\). Quadratically signed\n weight enumerators (QWGTs) are a generalization of this: \n \\( S(A,B,x,y) = \\sum_{c:Ac=0} (-1)^{c^T B c} x^{|c|} y^{n-|c|} \\). Now consider the\n following special case. Let <i>A</i> be an \\( n \\times n \\) matrix over \\( \\mathbb{Z}_2 \\)\n such that diag(<i>A</i>)=I. Let lwtr(<i>A</i>) be the lower triangular matrix resulting\n from setting all entries above the diagonal in <i>A</i> to zero. Let <i>l,k</i> be positive\n integers. Given the promise that \n \\( |S(A,\\mathrm{lwtr}(A),k,l)| \\geq \\frac{1}{2} (k^2+l^2)^{n/2} \\)\n the problem of determining the sign of \\( S(A,\\mathrm{lwtr}(A),k,l) \\) is  BQP-complete,\n as shown by Knill and Laflamme in [<a href=""#Knill_QWGT"">65</a>]. The evaluation of QWGTs is\n also closely related to the evaluation of Ising and Potts model partition functions \n [<a href=""#Lidar_Ising"">67</a>,<a href=""#Geraci_QWGT1"">45</a>,<a href=""#Geraci_QWGT2"">46</a>].\n",,
,,,Simulated Annealing,Polynomial,"In simulated annealing, one has a series of Markov chains defined by\n stochastic matrices \\( M_1, M_2,\\ldots,M_n \\). These are slowly varying in the sense that\n their limiting distributions \\( pi_1, \\pi_2, \\ldots, \\pi_n \\) satisfy\n \\( |\\pi_{t+1} -\\pi_t| \\lt \\epsilon \\) for some small \\( \\epsilon \\).\n These distributions can often be thought of as thermal distributions at successively lower\n temperatures. If \\( \\pi_1 \\) can be easily prepared, then by applying this\n series of Markov chains one can sample from \\( \\pi_n \\). Typically, one wishes for\n \\( \\pi_n \\) to be a distribution over good solutions to some optimization problem. Let \n \\( \\delta_i \\) be the gap between the largest and second largest eigenvalues of\n \\( M_i \\). Let \\( \\delta = \\min_i \\delta_i \\). The run time of this classical algorithm\n is proportional to \\(  1/\\delta \\). Building upon results of Szegedy \n [<a href=""#Szegedy_arxiv"">135</a>,<a href=""#Szegedy"">85</a>], Somma <i>et al.</i> have \n shown [<a href=""#Somma"">84</a>, <a href=""#SBBK08"">177</a>] that\n quantum computers can sample from \\( \\pi_n \\) with a runtime\n proportional to \\( 1/\\sqrt{\\delta} \\). Additional methods by which\n classical Markov chain Monte Carlo algorithms can be sped up using\n quantum walks are given in [<a href=""#M15b"">265</a>].\n",,
,,,String Rewriting,Superpolynomial,"String rewriting is a fairly general model of computation. String\n rewriting systems (sometimes called grammars) are specified by a list of rules by which\n certain substrings are allowed to be replaced by certain other substrings. For example,\n context free grammars, are equivalent to the pushdown automata. In\n [<a href=""#Wocjan_strings"">59</a>], Janzing and Wocjan showed that a certain string\n rewriting problem is PromiseBQP-complete. Thus quantum computers can solve it in\n polynomial time, but classical computers probably cannot. Given three strings\n <i>s,t,t\'</i>, and a set of string rewriting rules satisfying certain promises, the\n problem is to find a certain approximation to the difference between the number of\n ways of obtaining <i>t</i> from <i>s</i> and the number of ways of obtaining <i>t\'</i>\n from <i>s</i>. Similarly, certain problems of approximating the difference in number of\n paths between pairs of vertices in a graph, and difference in transition probabilities\n between pairs of states in a random walk are also BQP-complete\n [<a href=""#Wocjan_walks"">58</a>].\n",,
,,,Matrix Powers,Superpolynomial,"Quantum computers have an exponential advantage in approximating\n matrix elements of powers of exponentially large sparse matrices. Suppose we are have\n an \\( N \\times N \\) symmetric matrix <i>A</i> such that there are at most polylog(<i>N</i>)\n nonzero entries in each row, and given a row index, the set of nonzero entries can be\n efficiently computed. The task is, for any 1 &lt; <i>i</i> &lt; <i>N</i>, and any <i>m</i>\n polylogarithmic in <i>N</i>, to approximate \\( (A^m)_{ii} \\) the \\( i^{\\mathrm{th}} \\)\n diagonal matrix element of \\( A^m \\). The approximation is additive to within\n \\( b^m \\epsilon \\) where <i>b</i> is a given upper bound on |<i>A</i>| and \\( \\epsilon \\)\n is of order 1/polylog(<i>N</i>). As shown by Janzing and Wocjan, this problem is\n PromiseBQP-complete, as is the corresponding problem for off-diagonal matrix elements\n [<a href=""#Wocjan_matrix"">60</a>]. Thus, quantum computers can solve it in polynomial\n time, but classical computers probably cannot.\n",,
